{
  "$schema": "http://json-schema.org/draft-07/schema#",
  "$id": "https://videoworldskills.local/schemas/skill_wiki/meta.schema.json",
  "title": "Skill Wiki per-skill meta",
  "type": "object",
  "required": [
    "skill_id",
    "skill_name",
    "tier",
    "category_path",
    "schema_version",
    "wash_version",
    "license",
    "exec_ok",
    "source"
  ],
  "additionalProperties": true,
  "properties": {
    "skill_id": {"type": "string", "pattern": "^[a-z0-9][a-z0-9_]*[a-z0-9]$"},
    "skill_name": {"type": "string", "minLength": 1},
    "tier": {"type": "string", "enum": ["T1", "T2", "T3", "T4", "T5"]},
    "tier_label": {"type": "string"},
    "category_path": {
      "type": "array",
      "minItems": 1,
      "maxItems": 3,
      "items": {"type": "string", "pattern": "^[a-z0-9][a-z0-9_]*$"}
    },
    "modalities_present": {
      "type": "array",
      "items": {"type": "string", "enum": ["source", "visual", "text", "code"]}
    },
    "schema_version": {"type": "string"},
    "wash_version": {"type": "string"},
    "license": {"type": ["string", "null"]},
    "exec_ok": {"type": ["boolean", "null"]},
    "judge_score": {"type": ["number", "null"]},
    "wash_errors": {"type": "array", "items": {"type": "string"}},
    "wash_run_at": {"type": "string"},
    "source": {
      "type": "object",
      "required": ["type"],
      "properties": {
        "type": {
          "type": "string",
          "enum": ["youtube", "github", "article", "docs", "manual", "distilled", "static_artifact"]
        },
        "url": {"type": ["string", "null"]},
        "channel": {"type": ["string", "null"]},
        "captured": {"type": ["string", "null"]}
      }
    },
    "applicability": {"type": "string"},
    "tags": {"type": "array", "items": {"type": "string"}}
  }
}
