{
  "applicability": "",
  "category_path": [
    "uncategorized"
  ],
  "exec_ok": null,
  "license": "youtube_review_pending",
  "modalities_present": [
    "visual",
    "text"
  ],
  "schema_version": "1.0.0",
  "skill_id": "basic_primitive_transformation_and_assem_f51eed41",
  "skill_name": "Basic Primitive Transformation and Assembly",
  "source": {
    "channel": "RoBuilder",
    "type": "youtube",
    "url": "https://www.youtube.com/watch?v=QTnBCUqyUX0"
  },
  "tags": [],
  "tier": "T3",
  "wash_run_at": "2026-04-27T08:23:43Z",
  "wash_version": "1.0.0"
}