{
  "applicability": "",
  "category_path": [
    "uncategorized"
  ],
  "exec_ok": null,
  "license": "youtube_review_pending",
  "modalities_present": [
    "text"
  ],
  "schema_version": "1.0.0",
  "skill_id": "the_rule_of_3__a_a_a__form_progression_a24b3d62",
  "skill_name": "The Rule of 3 (A-A-A' Form Progression)",
  "source": {
    "channel": "Nathan James Larsen",
    "type": "youtube",
    "url": "https://www.youtube.com/watch?v=iiL3K3ewfuc"
  },
  "tags": [],
  "tier": "T3",
  "wash_run_at": "2026-04-27T09:35:19Z",
  "wash_version": "1.0.0"
}