{
  "applicability": "",
  "category_path": [
    "uncategorized"
  ],
  "exec_ok": null,
  "license": "youtube_review_pending",
  "modalities_present": [
    "text"
  ],
  "schema_version": "1.0.0",
  "skill_id": "4_bar_multi_track_epic_arrangement__rock_d79c5f82",
  "skill_name": "4-Bar Multi-Track Epic Arrangement (Rock/Metal Template)",
  "source": {
    "channel": "Reapertips | Alejandro",
    "type": "youtube",
    "url": "https://www.youtube.com/watch?v=bc58K9a_kW4"
  },
  "tags": [],
  "tier": "T3",
  "wash_run_at": "2026-04-27T11:08:48Z",
  "wash_version": "1.0.0"
}