{
  "applicability": "",
  "category_path": [
    "uncategorized"
  ],
  "exec_ok": null,
  "license": "youtube_review_pending",
  "modalities_present": [
    "text"
  ],
  "schema_version": "1.0.0",
  "skill_id": "cinematic_parallax_hero_with_depth_break_4d4b0f50",
  "skill_name": "Cinematic Parallax Hero with Depth-Breaking Elements",
  "source": {
    "channel": "Flux Academy",
    "type": "youtube",
    "url": "https://www.youtube.com/watch?v=LJbkLdtEW00"
  },
  "tags": [],
  "tier": "T3",
  "wash_run_at": "2026-04-27T09:59:50Z",
  "wash_version": "1.0.0"
}