{
  "applicability": "",
  "category_path": [
    "uncategorized"
  ],
  "exec_ok": null,
  "license": "youtube_review_pending",
  "modalities_present": [
    "text"
  ],
  "schema_version": "1.0.0",
  "skill_id": "chopped_synth_swell_transition_with_ster_bf02e3c2",
  "skill_name": "Chopped Synth Swell Transition with Stereo Expansion",
  "source": {
    "channel": "The REAPER Blog",
    "type": "youtube",
    "url": "https://www.youtube.com/watch?v=jgUIOpybK8Y"
  },
  "tags": [],
  "tier": "T3",
  "wash_run_at": "2026-04-27T07:48:08Z",
  "wash_version": "1.0.0"
}