{
  "applicability": "",
  "category_path": [
    "uncategorized"
  ],
  "exec_ok": null,
  "license": "youtube_review_pending",
  "modalities_present": [
    "text"
  ],
  "schema_version": "1.0.0",
  "skill_id": "multi_track_rock_metal_band_template___a_d79c5f82",
  "skill_name": "Multi-Track Rock/Metal Band Template & Arrangement",
  "source": {
    "channel": "Reapertips | Alejandro",
    "type": "youtube",
    "url": "https://www.youtube.com/watch?v=bc58K9a_kW4"
  },
  "tags": [],
  "tier": "T3",
  "wash_run_at": "2026-04-27T11:10:10Z",
  "wash_version": "1.0.0"
}