{
  "applicability": "",
  "category_path": [
    "uncategorized"
  ],
  "exec_ok": null,
  "license": "youtube_review_pending",
  "modalities_present": [
    "visual",
    "text"
  ],
  "schema_version": "1.0.0",
  "skill_id": "fluid_auto_fit_grid_layout_8f2a34ce",
  "skill_name": "Fluid Auto-Fit Grid Layout",
  "source": {
    "channel": "Coding2GO",
    "type": "youtube",
    "url": "https://www.youtube.com/watch?v=3T0gjtXRNC0"
  },
  "tags": [],
  "tier": "T3",
  "wash_run_at": "2026-04-27T09:04:08Z",
  "wash_version": "1.0.0"
}