{
  "applicability": "",
  "category_path": [
    "uncategorized"
  ],
  "exec_ok": null,
  "license": "youtube_review_pending",
  "modalities_present": [
    "text"
  ],
  "schema_version": "1.0.0",
  "skill_id": "responsive_flexbox_navbar_with_toggleabl_c6937440",
  "skill_name": "Responsive Flexbox Navbar with Toggleable Hamburger Menu",
  "source": {
    "channel": "Web Dev Simplified",
    "type": "youtube",
    "url": "https://www.youtube.com/watch?v=At4B7A4GOPg"
  },
  "tags": [],
  "tier": "T3",
  "wash_run_at": "2026-04-27T10:07:12Z",
  "wash_version": "1.0.0"
}