{
  "applicability": "",
  "category_path": [
    "uncategorized"
  ],
  "exec_ok": null,
  "license": "youtube_review_pending",
  "modalities_present": [
    "visual",
    "text"
  ],
  "schema_version": "1.0.0",
  "skill_id": "in_grid_kpi_card_527a083d",
  "skill_name": "In-Grid KPI Card",
  "source": {
    "channel": "Office Tech Skill",
    "type": "youtube",
    "url": "https://www.youtube.com/watch?v=hxaflJodZsA"
  },
  "tags": [],
  "tier": "T3",
  "wash_run_at": "2026-04-27T11:38:27Z",
  "wash_version": "1.0.0"
}