{
  "applicability": "",
  "category_path": [
    "uncategorized"
  ],
  "exec_ok": null,
  "license": "youtube_review_pending",
  "modalities_present": [
    "visual",
    "text"
  ],
  "schema_version": "1.0.0",
  "skill_id": "16_step_generative_acid_bassline__tb_303_b7d2b2f8",
  "skill_name": "16-Step Generative Acid Bassline (TB-303 Style)",
  "source": {
    "channel": "Krinstar",
    "type": "youtube",
    "url": "https://www.youtube.com/watch?v=RuzpiVPB5L8"
  },
  "tags": [],
  "tier": "T3",
  "wash_run_at": "2026-04-27T11:23:02Z",
  "wash_version": "1.0.0"
}