{
  "applicability": "",
  "category_path": [
    "uncategorized"
  ],
  "exec_ok": null,
  "license": "youtube_review_pending",
  "modalities_present": [
    "text"
  ],
  "schema_version": "1.0.0",
  "skill_id": "offbeat_bassline___pluck_generator_b7d2b2f8",
  "skill_name": "Offbeat Bassline & Pluck Generator",
  "source": {
    "channel": "Krinstar",
    "type": "youtube",
    "url": "https://www.youtube.com/watch?v=RuzpiVPB5L8"
  },
  "tags": [],
  "tier": "T3",
  "wash_run_at": "2026-04-27T10:56:07Z",
  "wash_version": "1.0.0"
}