{
  "applicability": "",
  "category_path": [
    "uncategorized"
  ],
  "exec_ok": null,
  "license": "youtube_review_pending",
  "modalities_present": [
    "visual",
    "text"
  ],
  "schema_version": "1.0.0",
  "skill_id": "responsive_dual_column_hero_section_with_1494ef2b",
  "skill_name": "Responsive Dual-Column Hero Section with Custom Backgrounds",
  "source": {
    "channel": "Dani Krossing",
    "type": "youtube",
    "url": "https://www.youtube.com/watch?v=XDGig-nJUg8"
  },
  "tags": [],
  "tier": "T3",
  "wash_run_at": "2026-04-27T08:20:36Z",
  "wash_version": "1.0.0"
}