{
  "applicability": "",
  "category_path": [
    "uncategorized"
  ],
  "exec_ok": null,
  "license": "youtube_review_pending",
  "modalities_present": [
    "text"
  ],
  "schema_version": "1.0.0",
  "skill_id": "responsive_glassmorphism_sidebar_navbar_3751c4c2",
  "skill_name": "Responsive Glassmorphism Sidebar Navbar",
  "source": {
    "channel": "Coding2GO",
    "type": "youtube",
    "url": "https://www.youtube.com/watch?v=U8smiWQ8Seg"
  },
  "tags": [],
  "tier": "T3",
  "wash_run_at": "2026-04-27T10:28:01Z",
  "wash_version": "1.0.0"
}