{
  "applicability": "",
  "category_path": [
    "uncategorized"
  ],
  "exec_ok": null,
  "license": "youtube_review_pending",
  "modalities_present": [
    "text"
  ],
  "schema_version": "1.0.0",
  "skill_id": "clean_dashboard_layout_archetype_066bbd71",
  "skill_name": "Clean Dashboard Layout Archetype",
  "source": {
    "channel": "Kevin Stratvert",
    "type": "youtube",
    "url": "https://www.youtube.com/watch?v=MTlQvyNQ3PM"
  },
  "tags": [],
  "tier": "T3",
  "wash_run_at": "2026-04-27T11:09:52Z",
  "wash_version": "1.0.0"
}