{
  "applicability": "",
  "category_path": [
    "uncategorized"
  ],
  "exec_ok": null,
  "license": "youtube_review_pending",
  "modalities_present": [
    "visual",
    "text"
  ],
  "schema_version": "1.0.0",
  "skill_id": "stylized_low_poly_game_prop__wooden_barr_652f7875",
  "skill_name": "Stylized Low-Poly Game Prop (Wooden Barrel)",
  "source": {
    "channel": "Versatile Vertices",
    "type": "youtube",
    "url": "https://www.youtube.com/watch?v=smluafHtCeY"
  },
  "tags": [],
  "tier": "T3",
  "wash_run_at": "2026-04-27T11:36:11Z",
  "wash_version": "1.0.0"
}