{
  "applicability": "",
  "category_path": [
    "uncategorized"
  ],
  "exec_ok": null,
  "license": "youtube_review_pending",
  "modalities_present": [
    "text"
  ],
  "schema_version": "1.0.0",
  "skill_id": "procedural_true_displacement_pbr_surface_dedd2236",
  "skill_name": "Procedural True Displacement PBR Surface",
  "source": {
    "channel": "Olav3D Tutorials",
    "type": "youtube",
    "url": "https://www.youtube.com/watch?v=144TWlEYFtM"
  },
  "tags": [],
  "tier": "T3",
  "wash_run_at": "2026-04-27T10:50:58Z",
  "wash_version": "1.0.0"
}