{
  "applicability": "",
  "category_path": [
    "uncategorized"
  ],
  "exec_ok": null,
  "license": "youtube_review_pending",
  "modalities_present": [
    "text"
  ],
  "schema_version": "1.0.0",
  "skill_id": "scale_locked_piano_roll_guide_generator_bba9520f",
  "skill_name": "Scale-Locked Piano Roll Guide Generator",
  "source": {
    "channel": "IDDQD Sound",
    "type": "youtube",
    "url": "https://www.youtube.com/watch?v=tqyrbtYWg3U"
  },
  "tags": [],
  "tier": "T3",
  "wash_run_at": "2026-04-27T09:48:31Z",
  "wash_version": "1.0.0"
}