{
  "applicability": "",
  "category_path": [
    "uncategorized"
  ],
  "exec_ok": null,
  "license": "youtube_review_pending",
  "modalities_present": [
    "visual",
    "text"
  ],
  "schema_version": "1.0.0",
  "skill_id": "frosted_glass_dashboard_with_dynamic_gra_f4b9e561",
  "skill_name": "Frosted Glass Dashboard with Dynamic Gradients and Dark Mode Toggle",
  "source": {
    "channel": "Echoes of Ping",
    "type": "youtube",
    "url": "https://www.youtube.com/watch?v=NY9ojDOjOcw"
  },
  "tags": [],
  "tier": "T3",
  "wash_run_at": "2026-04-27T08:37:32Z",
  "wash_version": "1.0.0"
}